id,date_iso,title,summary,category,source,url
"evt-2025-06-09-apple-wwdc","2025-06-09","Apple WWDC 2025: Apple Intelligence and platform redesign","Apple unveiled Apple Intelligence and a platform redesign across iOS, iPadOS and macOS focused on stronger on-device AI, privacy, and efficient local inference. New developer APIs support RAG, intent routing and document handling. System optimizations target battery and thermal gains to enable privacy-preserving, hybrid AI apps for enterprises.","Devices","Apple News","https://www.apple.com/newsroom/2025/06/apple-intelligence-gets-even-more-powerful-with-new-capabilities-across-apple-devices/"
"evt-2025-06-17-google-gemini-25","2025-06-17","Google releases Gemini 2.5 Pro","Google released Gemini 2.5 Pro with improved multimodal reasoning, longer-context handling and document QA across text and images. A low-latency Flash variant targets interactive use. Features reduce hallucinations, add regional deployment controls, and simplify streaming and embedding workflows for enterprise pilots in support, automation and search.","AI / Cloud","Google Cloud (Vertex AI)","https://cloud.google.com/vertex-ai/generative-ai/docs/models/gemini/2-5-pro"
"evt-2025-07-01-google-gemini-drops","2025-07-01","Google launches Gemini Drops cadence","Google introduced Gemini Drops, a monthly stream of incremental updates delivering language coverage, safety rules, SDK improvements and latency gains. The cadence accelerates feature delivery but increases testing and version management needs. Enterprises should automate validation, monitoring and RAG pipeline checks to safely absorb frequent model changes.","AI","Google Blog","https://blog.google/products/gemini/gemini-drop-july-2025/"
"evt-2025-07-02-msft-layoffs","2025-07-02","Microsoft restructures to prioritize AI and cloud","Microsoft announced layoffs and team reallocations to focus on AI, Copilot and Azure. Leadership emphasized reskilling and internal mobility. The shift reallocates engineering capacity to strategic cloud and AI work, potentially slowing non-core projects. Analysts recommend enterprises set clear pilot KPIs to measure vendor value amid vendor prioritization.","Layoffs","Reuters","https://www.reuters.com/business/world-at-work/microsoft-lay-off-many-9000-employees-seattle-times-reports-2025-07-02/"
"evt-2025-08-07-openai-gpt5","2025-08-07","OpenAI announces GPT-5 family","OpenAI introduced the GPT-5 family with stronger reasoning, longer contexts and multimodal fusion for images and video. The release adds enterprise controls and guidance for RAG and agent integrations. Partners began pilots for knowledge work and regulated industries. Analysts emphasize governance, inference cost and hybrid deployment tradeoffs for production assistants.","AI","OpenAI Blog","https://openai.com/index/introducing-gpt-5/"
"evt-2025-08-07-msft-gpt5-copilot","2025-08-07","Microsoft integrates GPT-5 into Copilot and Azure","Microsoft began integrating GPT-5 into Microsoft 365 Copilot, Copilot Studio and Azure AI, adding tenant isolation, hybrid options, audit logs and RBAC. The upgrades support multi-document reasoning, coding assistance and workflow automation. Developer tooling focuses on building composite chains with SLA monitoring for enterprise deployments.","AI / Cloud","Microsoft Blog","https://www.microsoft.com/en-us/microsoft-365/blog/2025/08/07/available-today-gpt-5-in-microsoft-365-copilot/"
"evt-2025-09-09-apple-iphone17","2025-09-09","Apple debuts iPhone 17 family with AI focused hardware updates","Apple introduced the iPhone 17 family with fortified neural engines, upgraded sensors and thermal/battery tuning to boost on-device AI and faster local RAG. The hardware targets richer privacy-preserving experiences. Developers and enterprises should validate apps for new performance and sensor capabilities on these devices.","Devices","Apple News","https://www.apple.com/newsroom/2025/09/apple-debuts-iphone-17/"
"evt-2025-09-10-meta-ai-research-update","2025-09-10","Meta publishes expansive AI research update","Meta published research on scaling, multimodal reasoning and personalization highlighting retrieval-augmented agents, cross-modal alignment for video and text, and cost reduction strategies on commodity accelerators. The update focuses on safety calibration, latency reduction and moderation tooling with expected API and adapter tool releases for enterprises.","AI / Research","Meta Research","https://about.meta/research/2025/ai-update"
"evt-2025-09-08-amazon-bedrock-evolution","2025-09-08","Amazon updates Bedrock and scales foundation model tooling","AWS enhanced Bedrock with enterprise features: latency-optimized tiers, hybrid routing, RAG connectors, observability for hallucination and token economics, and compliance tools. Prebuilt agents target contract review, support and code pipelines. The changes lower prototype-to-production friction and give IT stronger governance and cost controls.","Cloud / AI","Amazon Web Services","https://aws.amazon.com/bedrock/2025-updates"
"evt-2025-08-22-nvidia-hgx-and-partner-ecosystem","2025-08-22","NVIDIA expands HGX offerings and partner ecosystem","NVIDIA expanded HGX with I/O and inference throughput improvements, validated stacks and monitoring across racks. Partnerships with hyperscalers and vendors aim to secure supply and reduce integration friction. The expansion supports customers scaling from pilots to sustained training and inference at datacenter scale.","Infrastructure / Chips","NVIDIA Press","https://nvidia.com/hgx/2025"
"evt-2025-08-10-meta-threads-and-ad-products","2025-08-10","Meta extends Threads and ad product interoperability","Meta updated Threads and ad products for contextual ad insertion, real-time recommendations and analytics linking engagement to conversions. Features use privacy-preserving signals and consent-driven integrations. Advertisers gain automated creative testing and controlled experiments to improve relevance while preserving creator transparency.","Products / Ads","Meta Product Blog","https://about.meta/threads/2025/ads-update"
"evt-2025-07-25-google-enterprise-security-updates","2025-07-25","Google updates enterprise security features for AI","Google added enterprise security controls for AI: policy enforcement, data residency, audit trails, DLP connectors and provenance tracking. NotebookLM and Vertex AI gained policy gates, redaction and consent capture to help regulated customers adopt AI with provable controls and smoother migration guides.","AI / Cloud","Google Cloud","https://cloud.google.com/security/ai-2025"